Sheet: tanks
A1: sysname | B1: axis | C1: origin | D1: min_angle | E1: max_angle | F1: accuracy | G1: max_velocity | H1: max_velocity_degrees
A2: #tanks
A3: bmp1_gun_hor | B3: z | C3: korpus.bashnya | D3: -180 | E3: 180 | F3: 2 | G3: =RC[1]*3.14/180 -> 0.34888888888888892 | H3: 20
A4: bmp1_gun_ver | B4: y | C4: korpus.bashnya.turret01 | D4: -7 | E4: 30 | F4: 15 | G4: =RC[1]*3.14/180 -> 0.10466666666666667 | H4: 6
A5: bmp1_ptur_hor | B5: z | C5: korpus.bashnya | D5: -180 | E5: 180 | F5: 2 | G5: =RC[1]*3.14/180 -> 0.34888888888888892 | H5: 20
A6: bmp1_ptur_ver | B6: y | C6: korpus.bashnya.turret01 | D6: 0 | E6: 20 | F6: 15 | G6: =RC[1]*3.14/180 -> 0.10466666666666667 | H6: 6
A7: bmp1_machine_gun_coaxial_ver | B7: y | C7: korpus.bashnya.turret02 | D7: -5 | E7: 20 | F7: 15 | G7: =RC[1]*3.14/180 -> 0.10466666666666667 | H7: 6
A8: bmp1_gl_ver | B8: y | C8: korpus | D8: 0 | E8: 0 | F8: 80 | G8: =RC[1]*3.14/180 -> 0.17444444444444446 | H8: 10
A9: gvozdika_gun_hor | B9: z | C9: korpus.bashnya | D9: -180 | E9: 180 | F9: 2 | G9: =RC[1]*3.14/180 -> 0.52333333333333332 | H9: 30
A10: gvozdika_gun_ver | B10: y | C10: korpus.bashnya.turret01 | D10: -7 | E10: 60 | F10: 15 | G10: =RC[1]*3.14/180 -> 0.17444444444444446 | H10: 10
A11: shilka_machine_gun_hor | B11: z | C11: korpus.bashnya | D11: -180 | E11: 180 | F11: 2 | G11: 1.04 | H11: 30
A12: shilka_machine_gun_ver | B12: y | C12: korpus.bashnya.turret01 | D12: -7 | E12: 80 | F12: 15 | G12: 0.7 | H12: 10
A13: t72_main_gun_hor | B13: z | C13: korpus.bashnya | D13: -180 | E13: 180 | F13: 5 | G13: =RC[1]*3.14/180 -> 0.69777777777777783 | H13: 40
A14: t72_main_gun_ver | B14: y | C14: korpus.bashnya.turret01 | D14: -7 | E14: 20 | F14: 15 | G14: =RC[1]*3.14/180 -> 0.17444444444444446 | H14: 10
A15: t72_machine_gun_hor | B15: z | C15: korpus.bashnya.turretbase01 | D15: -180 | E15: 180 | F15: 5 | G15: =RC[1]*3.14/180 -> 0.69777777777777783 | H15: 40
A16: t72_machine_gun_ver | B16: y | C16: korpus.bashnya.turretbase01.turret01 | D16: -10 | E16: 65 | F16: 15 | G16: =RC[1]*3.14/180 -> 0.34888888888888892 | H16: 20
A17: t72mp_machine_gun_ver | B17: y | C17: korpus.bashnya.turretbase01.turret01 | D17: -60 | E17: 65 | F17: 15 | G17: =RC[1]*3.14/180 -> 0.34888888888888892 | H17: 20
A18: t72_gl_ver | B18: y | C18: korpus | D18: 0 | E18: 0 | F18: 80 | G18: =RC[1]*3.14/180 -> 0.17444444444444446 | H18: 10
A19: main_gun_hor | B19: z | C19: korpus.bashnya | D19: -180 | E19: 180 | F19: 2 | G19: 2
A20: main_gun_ver | B20: y | C20: korpus.bashnya.turret01 | D20: -10 | E20: 20 | F20: 15 | G20: 2
A21: machine_gun_hor | B21: z | C21: korpus.bashnya | D21: -180 | E21: 180 | F21: 2 | G21: 2
A22: machine_gun_ver | B22: y | C22: korpus.bashnya | D22: -20 | E22: 20 | F22: 15 | G22: 2
A23: t55_main_gun_hor | B23: z | C23: korpus.bashnya | D23: -180 | E23: 180 | F23: 5 | G23: =RC[1]*3.14/180 -> 0.34888888888888892 | H23: 20
A24: t55_main_gun_ver | B24: y | C24: korpus.bashnya.turret01 | D24: -7 | E24: 20 | F24: 15 | G24: =RC[1]*3.14/180 -> 8.7222222222222229E-2 | H24: 5
A25: t55_machine_gun_hor | B25: z | C25: korpus.bashnya.turretbase01 | D25: -180 | E25: 180 | F25: 5 | G25: =RC[1]*3.14/180 -> 0.34888888888888892 | H25: 20
A26: t55_machine_gun_ver | B26: y | C26: korpus.bashnya.turretbase01.turret01 | D26: -10 | E26: 60 | F26: 15 | G26: =RC[1]*3.14/180 -> 8.7222222222222229E-2 | H26: 5
A27: t55_gl_ver | B27: y | C27: korpus | D27: 0 | E27: 0 | F27: 80 | G27: =RC[1]*3.14/180 -> 8.7222222222222229E-2 | H27: 5
A28: mlrs_gun_hor | B28: z | C28: korpus.bashnya | D28: -90 | E28: 90 | F28: 10 | G28: =RC[1]*3.14/180 -> 0.52333333333333332 | H28: 30
A29: mlrs_gun_ver | B29: y | C29: korpus.bashnya.turret01 | D29: 0 | E29: 70 | F29: 15 | G29: =RC[1]*3.14/180 -> 0.17444444444444446 | H29: 10
A30: tiger1_main_gun_hor | B30: z | C30: korpus.bashnya | D30: -180 | E30: 180 | F30: 5 | G30: 0.69777777777777783 | H30: 40
A31: tiger1_main_gun_ver | B31: y | C31: korpus.bashnya.turret01 | D31: -3 | E31: 17 | F31: 15 | G31: 0.17444444444444446 | H31: 10
A32: tiger1_machine_gun_hor | B32: z | C32: korpus.bashnya.turret01.mg02 | D32: -180 | E32: 180 | F32: 5 | G32: 0.69777777777777783 | H32: 40
A33: tiger1_machine_gun_ver | B33: y | C33: korpus.bashnya.turret01.mg02 | D33: -10 | E33: 65 | F33: 15 | G33: 0.17444444444444446 | H33: 20
A34: #cars
A35: brdm_machine_gun_hor | B35: z | C35: korpus.bashnya | D35: -180 | E35: 180 | F35: 5 | G35: =RC[1]*3.14/180 -> 1.0466666666666666 | H35: 60
A36: brdm_machine_gun_ver | B36: y | C36: korpus.bashnya.turret01 | D36: -7 | E36: 60 | F36: 15 | G36: =RC[1]*3.14/180 -> 0.17444444444444446 | H36: 10
A37: brdm_machine_gun_coaxial_ver | B37: y | C37: korpus.bashnya.turret02 | D37: -7 | E37: 20 | F37: 15 | G37: =RC[1]*3.14/180 -> 0.17444444444444446 | H37: 10
A38: brdm_missile_hor | B38: z | C38: korpus.bashnya | D38: -180 | E38: 180 | F38: 2 | G38: =RC[1]*3.14/180 -> 1.0466666666666666 | H38: 60
A39: brdm_missile_ver | B39: y | C39: korpus.bashnya | D39: 0 | E39: 0 | F39: 60 | G39: =RC[1]*3.14/180 -> 0.17444444444444446 | H39: 10
A40: btr70_machine_gun_hor | B40: z | C40: korpus.bashnya | D40: -180 | E40: 180 | F40: 2 | G40: =RC[1]*3.14/180 -> 1.0466666666666666 | H40: 60
A41: btr70_machine_gun_ver | B41: y | C41: korpus.bashnya.turret01 | D41: -7 | E41: 60 | F41: 15 | G41: =RC[1]*3.14/180 -> 0.17444444444444446 | H41: 10
A42: btr70_machine_gun_coaxial_ver | B42: y | C42: korpus.bashnya.turret02 | D42: -7 | E42: 60 | F42: 15 | G42: =RC[1]*3.14/180 -> 0.17444444444444446 | H42: 10
A43: btr80_machine_gun_hor | B43: z | C43: korpus.bashnya | D43: -180 | E43: 180 | F43: 2 | G43: =RC[1]*3.14/180 -> 1.0466666666666666 | H43: 60
A44: btr80_machine_gun_ver | B44: y | C44: korpus.bashnya.turret01 | D44: -7 | E44: 60 | F44: 15 | G44: =RC[1]*3.14/180 -> 0.17444444444444446 | H44: 10
A45: btr80_machine_gun_coaxial_ver | B45: y | C45: korpus.bashnya.turret02 | D45: -7 | E45: 60 | F45: 2 | G45: =RC[1]*3.14/180 -> 0.17444444444444446 | H45: 10
A46: btr80_gun_ver | B46: y | C46: korpus.bashnya.turret01 | D46: -7 | E46: 60 | F46: 15 | G46: =RC[1]*3.14/180 -> 0.17444444444444446 | H46: 10
A47: btr80_mg_ver | B47: y | C47: korpus.bashnya.turret02 | D47: -7 | E47: 60 | F47: 15 | G47: =RC[1]*3.14/180 -> 0.17444444444444446 | H47: 10
A48: btr80_gl_ver | B48: y | C48: korpus | D48: 0 | E48: 0 | F48: 60 | G48: =RC[1]*3.14/180 -> 0.17444444444444446 | H48: 10
A49: grad_gun_hor | B49: z | C49: korpus.bashnya | D49: -180 | E49: 180 | F49: 10 | G49: =RC[1]*3.14/180 -> 0.52333333333333332 | H49: 30
A50: grad_gun_ver | B50: y | C50: korpus.bashnya.turret01 | D50: 0 | E50: 70 | F50: 15 | G50: =RC[1]*3.14/180 -> 0.17444444444444446 | H50: 10
A51: toyota_machine_gun_hor | B51: z | C51: korpus.bashnya | D51: -180 | E51: 180 | F51: 5 | G51: 2
A52: toyota_machine_gun_ver | B52: y | C52: korpus.bashnya.turret01 | D52: -5 | E52: 50 | F52: 15 | G52: 2
A53: toyota_stinger_hor | B53: z | C53: korpus.bashnya | D53: -180 | E53: 180 | F53: 2 | G53: 2
A54: toyota_stinger_ver | B54: y | C54: korpus.bashnya.turret01 | D54: -10 | E54: 70 | F54: 2 | G54: 2
A55: toyota_dzhigit_hor | B55: z | C55: korpus.bashnya | D55: -180 | E55: 180 | F55: 2 | G55: 2
A56: toyota_dzhigit_ver | B56: y | C56: korpus.bashnya.turret01 | D56: -10 | E56: 70 | F56: 2 | G56: 2
A57: toyota_type63_hor | B57: z | C57: korpus.bashnya | D57: -180 | E57: 180 | F57: 10 | G57: =RC[1]*3.14/180 -> 0.52333333333333332 | H57: 30
A58: toyota_type63_ver | B58: y | C58: korpus.bashnya.turret01 | D58: -20 | E58: 75 | F58: 15 | G58: =RC[1]*3.14/180 -> 0.17444444444444446 | H58: 10
A59: guntruck_type63_hor | B59: z | C59: korpus.bashnya | D59: -180 | E59: 180 | F59: 10 | G59: =RC[1]*3.14/180 -> 0.52333333333333332 | H59: 30
A60: guntruck_type63_ver | B60: y | C60: korpus.bashnya.turret01 | D60: -90 | E60: 90 | F60: 15 | G60: =RC[1]*3.14/180 -> 0.17444444444444446 | H60: 10
A61: guntruck_ptur_hor | B61: z | C61: korpus.bashnya | D61: -180 | E61: 180 | F61: 5 | G61: 2
A62: guntruck_ptur_ver | B62: y | C62: korpus.bashnya.turretbase01.turret01 | D62: -5 | E62: 40 | F62: 15 | G62: 2
A63: guntruck_zu_hor | B63: z | C63: korpus.bashnya | D63: -180 | E63: 180 | F63: 5 | G63: =RC[1]*3.14/180 -> 0.52333333333333332 | H63: 30
A64: guntruck_zu_ver | B64: y | C64: korpus.bashnya.turret01 | D64: -7 | E64: 80 | F64: 15 | G64: =RC[1]*3.14/180 -> 0.17444444444444446 | H64: 10
A65: guntruck_b10_hor | B65: z | C65: korpus.bashnya | D65: -180 | E65: 180 | F65: 2 | G65: =RC[1]*3.14/180 -> 0.34888888888888892 | H65: 20
A66: guntruck_b10_ver | B66: y | C66: korpus.bashnya.turretbase01 | D66: -7 | E66: 30 | F66: 15 | G66: =RC[1]*3.14/180 -> 0.10466666666666667 | H66: 6
A67: tigr_gun_hor | B67: z | C67: korpus.bashnya | D67: -180 | E67: 180 | F67: 5 | G67: 2
A68: tigr_gun_ver | B68: y | C68: korpus.bashnya.turretbase01 | D68: -5 | E68: 50 | F68: 15 | G68: 2
A69: tigr_gl_hor | B69: z | C69: korpus.bashnya | D69: -180 | E69: 180 | F69: 2 | G69: =RC[1]*3.14/180 -> 0.34888888888888892 | H69: 20
A70: tigr_gl_ver | B70: y | C70: korpus.bashnya | D70: -7 | E70: 30 | F70: 15 | G70: =RC[1]*3.14/180 -> 0.10466666666666667 | H70: 6
A71: #helicopters
A72: mi24_machine_gun_hor | B72: z | C72: korpus.bashnya | D72: -110 | E72: 110 | F72: 5 | G72: 2
A73: mi24_machine_gun_ver | B73: y | C73: korpus.bashnya.turret01 | D73: -90 | E73: 20 | F73: 20 | G73: 2
A74: mi24_nurs_hor | B74: z | C74: korpus | D74: 0 | E74: 0 | F74: 15 | G74: 2
A75: mi24_nurs_ver | B75: y | C75: korpus | D75: 0 | E75: 0 | F75: 60 | G75: 2
A76: mi24_ptur_hor | B76: z | C76: korpus | D76: 0 | E76: 0 | F76: 15 | G76: 2
A77: mi24_ptur_ver | B77: y | C77: korpus | D77: 0 | E77: 0 | F77: 60 | G77: 2
A78: mi24_bombs_hor | B78: z | C78: korpus | D78: 0 | E78: 0 | F78: 15 | G78: 2
A79: mi24_bombs_ver | B79: y | C79: korpus | D79: 0 | E79: 0 | F79: 60 | G79: 2
A80: mi8_machine_gun_hor | B80: z | C80: korpus | D80: 0 | E80: 0 | F80: 5 | G80: 2
A81: mi8_machine_gun_ver | B81: y | C81: korpus | D81: 0 | E81: 0 | F81: 20 | G81: 2
A82: mi8_gun_hor | B82: z | C82: korpus.bashnya | D82: -90 | E82: 90 | F82: 5 | G82: 2
A83: mi8_gun_ver | B83: y | C83: korpus.bashnya.turret01 | D83: -90 | E83: 20 | F83: 15 | G83: 2
A84: mi8_nurs_hor | B84: z | C84: korpus | D84: 0 | E84: 0 | F84: 15 | G84: 2
A85: mi8_nurs_ver | B85: y | C85: korpus | D85: 0 | E85: 0 | F85: 60 | G85: 2
A86: mi8_ptur_hor | B86: z | C86: korpus | D86: 0 | E86: 0 | F86: 15 | G86: 2
A87: mi8_ptur_ver | B87: y | C87: korpus | D87: 0 | E87: 0 | F87: 60 | G87: 2
A88: mi24_flare_hor | B88: z | C88: korpus | D88: 0 | E88: 0 | F88: 2 | G88: 2
A89: mi24_flare_ver | B89: y | C89: korpus | D89: 0 | E89: 0 | F89: 2 | G89: 2
A90: mi8_flare_hor | B90: z | C90: korpus | D90: 0 | E90: 0 | F90: 2 | G90: 2
A91: mi8_flare_ver | B91: y | C91: korpus | D91: 0 | E91: 0 | F91: 2 | G91: 2
A92: #mine
A93: t34_main_gun_hor | B93: z | C93: korpus.bashnya | D93: -180 | E93: 180 | F93: 5 | G93: 0.69777777777777783 | H93: 40
A94: t34_main_gun_ver | B94: y | C94: korpus.bashnya.turret01 | D94: -3 | E94: 17 | F94: 15 | G94: 0.17444444444444446 | H94: 10
A95: t34_machine_gun_hor | B95: z | C95: korpus.mg01 | D95: -15 | E95: 15 | F95: 5 | G95: 0.69777777777777783 | H95: 40
A96: t34_machine_gun_ver | B96: y | C96: korpus.mg01 | D96: -5 | E96: 5 | F96: 15 | G96: 0.17444444444444446 | H96: 10